{
  "schemaId": "urn:gala:schema:content-frontmatter:2.0.0",
  "schemaVersion": "2.0.0",
  "id": "019c0000-0000-7000-8000-000000000001",
  "kind": "article",
  "title": "fixture-1",
  "language": "en-US",
  "authors": ["019c0000-0000-7000-8000-000000000001"],
  "tags": ["fixture-1"],
  "status": "draft",
  "createdAt": "2026-09-13T12:00:00.000Z",
  "slug": "fixture-1",
  "redirects": ["/fixture-1"],
  "extensions": {}
}
